brand,influencer,score,reason
Lululemon,Emma Chamberlain,0.75,"Emma Chamberlain embodies a youthful, active lifestyle and has a strong connection to wellness through her coffee brand, but her content primarily focuses on lifestyle and humor rather than fitness or yoga, which may not fully align with Lululemon's core values."
Lyft,George Lopez,0.75,"George Lopez embodies a modern, tech-savvy lifestyle and has a strong connection to the Latino community, which aligns with Lyft's inclusivity focus. However, while he promotes community and social impact, his content may not consistently emphasize urban mobility or eco-friendly transportation options."
Redbull,George Lopez,0.25,"George Lopez's content primarily focuses on comedy and cultural commentary rather than extreme sports or high-energy activities, which does not align well with Redbull's adventurous brand identity."
Kroger,George Lopez,0.75,"George Lopez embodies a strong connection to family and community, which aligns with Kroger's values, but his focus on comedy and entertainment may not fully resonate with the culinary expertise and health focus that Kroger emphasizes."
Sephora,George Lopez,0.2,"George Lopez is primarily known for his comedy and acting rather than beauty expertise, which does not align with Sephora's focus on beauty and skincare trends. His content may lack the high-quality visual aesthetic and deep product knowledge that Sephora seeks in influencers."
Nestle,George Lopez,0.6,"George Lopez has a strong connection to the Latino community and promotes inclusivity, but his content primarily focuses on comedy and personal experiences rather than health and nutrition, which may not align closely with Nestle's brand criteria."
Lululemon,George Lopez,0.3,"While George Lopez is a prominent figure and has a strong connection to the Latino community, his content primarily focuses on comedy and entertainment rather than the active, mindful lifestyle that Lululemon promotes. His engagement with wellness and fitness is not as pronounced, which may not align well with Lululemon's brand values."
Lyft,Google,0.0,"Google, as a multinational technology corporation, does not embody the modern, tech-savvy lifestyle or community focus that Lyft seeks in influencers, making it unsuitable for promoting Lyft's urban mobility and connectivity services."
Redbull,Google,0.0,"Google, as a multinational technology corporation, does not embody the extreme lifestyle or adventurous ethos that Redbull represents, making it unsuitable for their brand alignment."
Kroger,Google,0.0,"Google, as a multinational technology corporation, does not embody the reliability, approachability, or community connection that Kroger seeks in influencers, nor does it focus on culinary expertise or local sourcing."
Sephora,Google,0.0,"Google, as a technology company, does not align with Sephora's criteria for beauty expertise, trendsetting, and community engagement in the beauty space."
Nestle,Google,0.0,"Google, as a technology company, does not align with Nestle's focus on health, nutrition, and community engagement, making it unsuitable for promoting Nestle's diverse food and beverage products."
Lululemon,Google,0.0,"Google, as a multinational technology corporation, does not embody the active, mindful, and balanced lifestyle that Lululemon promotes, nor does it focus on health, fitness, or personal growth, making it unsuitable for the brand's advertising needs."
Lyft,Greta Lee,0.75,"Greta Lee's modern, tech-savvy image and her involvement in urban-centric projects align well with Lyft's focus on urban mobility and community. However, while she has experience in fashion advertising, her direct connection to sustainability and eco-friendly initiatives is less evident."
Redbull,Greta Lee,0.2,"Greta Lee's content primarily focuses on acting and personal storytelling rather than extreme sports or high-energy activities, which does not align well with Redbull's adventurous brand identity."
Kroger,Greta Lee,0.75,"Greta Lee's approachable persona and recent involvement in fashion campaigns suggest a strong connection to contemporary lifestyle, but her primary focus on acting and entertainment may not fully align with Kroger's emphasis on culinary expertise and community connection."
Sephora,Greta Lee,0.75,"Greta Lee has experience in high-profile fashion campaigns and a strong presence in the entertainment industry, which aligns well with Sephora's focus on beauty expertise and high-quality visual content. However, her primary content does not heavily emphasize beauty or skincare, which may limit her engagement with Sephora's specific audience."
Nestle,Greta Lee,0.75,"Greta Lee's recent work in health-focused narratives and her engagement in diverse communities align well with Nestle's emphasis on nutrition and inclusivity, though her primary focus has been in entertainment rather than health and wellness."
Lululemon,Greta Lee,0.75,"Greta Lee's active lifestyle and recent involvement in fashion campaigns suggest alignment with Lululemon's values, but her primary focus on acting and entertainment may not fully resonate with the brand's emphasis on wellness and fitness."
Lyft,Guns N' Roses,0.2,"Guns N' Roses, as a hard rock band with a history of controversy and a rebellious image, does not align well with Lyft's focus on modern, tech-savvy lifestyles, reliability, and inclusivity, making them a poor fit for the brand's values."
Redbull,Guns N' Roses,0.8,"Guns N' Roses embodies a bold and adventurous lifestyle, aligning well with Redbull's extreme sports ethos, and their dynamic visual storytelling resonates with the brand's energetic identity. However, their historical controversies may slightly detract from their overall suitability."
Kroger,Guns N' Roses,0.1,"Guns N' Roses, as a hard rock band known for their rebellious image and controversial history, does not align with Kroger's focus on reliability, family values, and healthy living, making them a poor fit for the brand."
Sephora,Guns N' Roses,0.0,"Guns N' Roses, as a rock band, does not align with Sephora's beauty and skincare focus, lacking the necessary expertise, authenticity, and engagement in the beauty community."
Nestle,Guns N' Roses,0.1,"Guns N' Roses, as a hard rock band known for their rebellious image and controversial lyrics, does not align with Nestle's focus on health, nutrition, and sustainability, making them a poor fit for the brand's values."
Lululemon,Guns N' Roses,0.0,"Guns N' Roses, as a hard rock band known for their rebellious image and controversial history, does not align with Lululemon's focus on wellness, mindfulness, and community engagement."
Lyft,Halsey,0.85,"Halsey embodies a modern, tech-savvy lifestyle and has a strong focus on inclusivity and social impact, aligning well with Lyft's values. However, her past controversies may raise questions about reliability and trustworthiness."
Redbull,Halsey,0.45,"While Halsey is a dynamic and influential artist with a strong following, her brand identity focuses more on personal storytelling and emotional themes rather than the extreme sports and high-energy lifestyle that Redbull embodies."
Kroger,Halsey,0.75,"Halsey embodies authenticity and community connection, which aligns with Kroger's values, but her focus on personal struggles and artistic expression may not directly resonate with the brand's emphasis on culinary expertise and family-oriented content."
Sephora,Halsey,0.85,"Halsey has a strong passion for beauty and has previously collaborated with brands like MAC, showcasing her trendsetting abilities. Her authenticity and diverse representation align well with Sephora's inclusive ethos, although her primary focus is music rather than beauty content."
Nestle,Halsey,0.75,"Halsey has a strong global presence and engages with diverse communities, but her focus on personal struggles and activism may not align perfectly with Nestle's emphasis on health, nutrition, and sustainability."
Lululemon,Halsey,0.75,"Halsey embodies a strong personal narrative around mental health and activism, which aligns with Lululemon's values of wellness and community engagement; however, her primary focus is on music and personal struggles rather than fitness or yoga, which may limit her direct alignment with the brand's core lifestyle."
Lyft,Heidi Klum,0.85,"Heidi Klum embodies a modern, tech-savvy lifestyle and has a strong public presence that aligns with Lyft's focus on urban mobility and community. However, her recent focus on personal beauty and body image may not directly connect with Lyft's sustainability and social impact messaging."
Redbull,Heidi Klum,0.2,"Heidi Klum's brand image is more aligned with fashion and entertainment rather than extreme sports or high-energy activities, which does not resonate with Redbull's adventurous and adrenaline-fueled ethos."
Kroger,Heidi Klum,0.75,"Heidi Klum embodies a strong public persona and has experience in promoting lifestyle brands, but her focus on high fashion and celebrity culture may not fully align with Kroger's emphasis on everyday family life and community connection."
Sephora,Heidi Klum,0.9,"Heidi Klum has extensive experience in the beauty and fashion industry, showcasing her expertise and trendsetting capabilities, which align well with Sephora's brand criteria. Her strong public presence and engagement with diverse audiences further enhance her suitability for promoting Sephora's inclusive and innovative beauty products."
Nestle,Heidi Klum,0.75,"Heidi Klum's extensive experience in promoting health and wellness products aligns well with Nestle's focus on nutrition, but her celebrity status may not fully reflect the diverse portfolio and community engagement that Nestle seeks."
Lululemon,Heidi Klum,0.75,"Heidi Klum embodies a lifestyle that includes fitness and wellness, aligning with Lululemon's values, but her recent focus on candid discussions about body image may not fully resonate with the brand's premium and aspirational image."
Lyft,Hilary Duff,0.75,"Hilary Duff embodies a modern lifestyle and has a strong connection with diverse audiences, making her suitable for Lyft's focus on urban mobility and community. However, her recent controversies may slightly detract from the reliability and trustworthiness aspect that Lyft values."
Redbull,Hilary Duff,0.25,"While Hilary Duff has a strong following and engages in various entrepreneurial ventures, her brand image is more aligned with family-friendly content and mainstream entertainment rather than the extreme sports and adventurous lifestyle that Redbull embodies."
Kroger,Hilary Duff,0.75,"Hilary Duff embodies a relatable and approachable image, aligning well with Kroger's focus on family and community values. However, while she promotes healthy living and has a diverse appeal, her recent ventures and controversies may not fully align with Kroger's sustainability and local sourcing initiatives."
Sephora,Hilary Duff,0.85,"Hilary Duff has a strong background in beauty and fashion, demonstrated through her successful collaborations and product lines, aligning well with Sephora's focus on beauty expertise and trendsetting. Her engagement with a diverse audience and polished visual content further supports her suitability for the brand."
Nestle,Hilary Duff,0.75,"Hilary Duff has a strong public image and a diverse portfolio that aligns with Nestle's focus on health and nutrition, but her past controversies and emphasis on personal branding may not fully reflect Nestle's commitment to sustainability and ethical practices."
Lululemon,Hilary Duff,0.75,"Hilary Duff embodies an active lifestyle and has engaged in wellness and fitness-related content, but her primary focus has been on entertainment and personal life rather than a consistent emphasis on health and fitness, which may not fully align with Lululemon's brand criteria."
Lyft,J. Cole,0.85,"J. Cole embodies a modern, tech-savvy lifestyle and has a strong community focus through his philanthropic efforts, aligning well with Lyft's values. His storytelling ability and appeal to a diverse audience further enhance his suitability for promoting Lyft's services."
Redbull,J. Cole,0.75,"J. Cole embodies a dynamic lifestyle and has a strong connection to sports, particularly basketball, which aligns with Redbull's adventurous ethos. However, while he engages with his community and showcases creativity, his content may not consistently reflect the extreme sports focus that Redbull prioritizes."
Kroger,J. Cole,0.75,"J. Cole's authenticity and community connection resonate well with Kroger's values, and his emphasis on healthy eating aligns with the brand's focus on fresh produce. However, his primary identity as a rapper may not fully embody the everyday living aspect that Kroger seeks."
Sephora,J. Cole,0.2,"J. Cole is primarily known as a rapper and musician, lacking a strong focus on beauty, skincare, or cosmetics, which are essential for Sephora's brand criteria. His content does not align with the beauty expertise and trendsetting required for effective promotion in this space."
Nestle,J. Cole,0.75,"J. Cole's focus on social issues, community engagement, and authenticity aligns well with Nestle's values, but his primary brand identity is rooted in music and culture rather than health and nutrition, which may limit his effectiveness in promoting Nestle's diverse product range."
Lululemon,J. Cole,0.6,"While J. Cole embodies elements of an active lifestyle and has a strong community engagement through his music and initiatives, his primary focus is on hip-hop and social issues rather than fitness or wellness, which may not fully align with Lululemon's brand criteria."
Lyft,Jack Quaid,0.75,"Jack Quaid embodies a modern lifestyle and has a diverse audience appeal, particularly through his roles in popular series like 'The Boys' and 'Star Trek: Lower Decks'. However, while he can effectively engage audiences, his content may not consistently emphasize sustainability or community initiatives, which are key criteria for Lyft."
Redbull,Jack Quaid,0.6,"While Jack Quaid is a well-known actor with a dynamic presence, his content primarily revolves around acting and voice roles rather than extreme sports or high-energy activities, which may not fully align with Redbull's adventurous brand ethos."
Kroger,Jack Quaid,0.6,"Jack Quaid's approachable persona and connection to family-oriented content through his roles may resonate with Kroger's values, but his primary focus on entertainment and lack of culinary expertise or community-centric content limits his alignment with the brand's specific criteria."
Sephora,Jack Quaid,0.2,"Jack Quaid is primarily known as an actor and does not have a strong focus on beauty or skincare content, which is essential for Sephora's brand criteria. His engagement with beauty trends and product knowledge appears limited, making him less suitable for this campaign."
Nestle,Jack Quaid,0.6,"Jack Quaid has a strong public presence and appeals to a diverse audience, but his content primarily focuses on entertainment rather than health and nutrition, which may not align closely with Nestle's brand values."
Lululemon,Jack Quaid,0.6,"Jack Quaid is primarily known for his acting roles and does not prominently embody the active, wellness-focused lifestyle that Lululemon promotes, which may affect his authenticity for the brand. However, his engagement in popular culture and potential relatability to a younger audience could still align with Lululemon's community engagement goals."
Lyft,Jake Shane,0.75,"Jake Shane's modern, tech-savvy persona and his appeal to a diverse audience align well with Lyft's brand values, particularly in urban mobility and inclusivity. However, his primary focus on comedy and personal storytelling may not directly emphasize Lyft's reliability and sustainability aspects as strongly as desired."
Redbull,Jake Shane,0.25,"Jake Shane's content primarily focuses on humor and historical reenactments rather than extreme sports or high-energy activities, which does not align well with Redbull's adventurous brand identity."
Kroger,Jake Shane,0.45,"While Jake Shane has a strong social media presence and appeals to a diverse audience, his content primarily focuses on humor and entertainment rather than culinary expertise or family-oriented themes, which are central to Kroger's brand values."
Sephora,Jake Shane,0.2,"Jake Shane's content primarily focuses on humor and historical reenactments rather than beauty, skincare, or cosmetics, which does not align with Sephora's brand criteria for beauty expertise and trendsetting."
Nestle,Jake Shane,0.45,"Jake Shane's comedic and entertainment-focused content may not align closely with Nestle's emphasis on health, nutrition, and sustainability, despite his large following and community engagement."
Lululemon,Jake Shane,0.3,"Jake Shane's content primarily focuses on humor and entertainment rather than fitness or wellness, which does not align closely with Lululemon's brand values of an active lifestyle and community engagement."
Lyft,Jalen Hurts,0.75,"Jalen Hurts embodies a modern, tech-savvy lifestyle as a prominent NFL quarterback, appealing to a diverse audience. However, while he promotes community and inclusivity, his primary focus is on sports rather than urban mobility, which may limit his alignment with Lyft's core messaging."
Redbull,Jalen Hurts,0.75,"Jalen Hurts embodies a dynamic and energetic lifestyle as a professional athlete, aligning well with Redbull's adventurous brand ethos; however, his primary focus is on football rather than extreme sports, which slightly limits his overall fit."
Kroger,Jalen Hurts,0.6,"Jalen Hurts embodies reliability and approachability as a prominent athlete, but his primary focus on sports may not align closely with Kroger's emphasis on culinary expertise and community connection, which are crucial for their brand messaging."
Sephora,Jalen Hurts,0.0,"Jalen Hurts is a professional football player with no evident expertise or focus in beauty, skincare, or cosmetics, making him unsuitable for promoting Sephora's beauty-centric brand."
Nestle,Jalen Hurts,0.75,"Jalen Hurts has a strong public image and engages with a diverse audience, but his primary focus is on sports rather than health and nutrition, which may not fully align with Nestle's emphasis on wellness and sustainability."
Lululemon,Jalen Hurts,0.75,"Jalen Hurts embodies an active lifestyle as a professional athlete, which aligns with Lululemon's focus on wellness and fitness. However, his content primarily revolves around football rather than yoga or mindfulness, which may limit his authenticity in promoting Lululemon's core values."
Lyft,Jason Derulo,0.75,"Jason Derulo embodies a modern, tech-savvy lifestyle and has a strong social media presence, which aligns well with Lyft's urban mobility focus. However, recent controversies may impact his reliability and trustworthiness, which are crucial for Lyft's brand image."
Redbull,Jason Derulo,0.75,"Jason Derulo embodies a dynamic and energetic persona, often engaging in high-energy performances and collaborations, which aligns well with Redbull's adventurous brand identity. However, his primary focus on music and entertainment may not fully resonate with the extreme sports aspect of Redbull's core values."
Kroger,Jason Derulo,0.45,"While Jason Derulo has a broad appeal and a strong social media presence, his brand image is more aligned with entertainment and pop culture rather than the reliability and community connection that Kroger seeks. Additionally, his recent controversies may detract from the authenticity and family-oriented values important to Kroger's brand."
Sephora,Jason Derulo,0.3,"While Jason Derulo has a significant following and engages with audiences, his primary focus is on music and entertainment rather than beauty, which may not align with Sephora's criteria for beauty expertise and trendsetting."
Nestle,Jason Derulo,0.45,"While Jason Derulo has a broad appeal and a significant following, his recent controversies, including a sexual harassment lawsuit, may undermine the authenticity and trustworthiness that Nestle seeks in its influencers. Additionally, his content does not consistently emphasize health and nutrition, which is crucial for aligning with Nestle's brand values."
Lululemon,Jason Derulo,0.45,"While Jason Derulo has a strong social media presence and engages with a large audience, his brand image is more aligned with mainstream pop culture and entertainment rather than the active, mindful lifestyle that Lululemon promotes."
Lyft,Jeffrey Dean Morgan,0.6,"Jeffrey Dean Morgan's public persona as a popular actor may resonate with a diverse audience, but his roles often portray darker, more villainous characters, which may not align with Lyft's emphasis on reliability, trustworthiness, and community focus."
Redbull,Jeffrey Dean Morgan,0.25,"While Jeffrey Dean Morgan is a well-known actor with a strong fanbase, his brand persona does not align closely with Redbull's extreme sports and adventurous lifestyle focus, which may limit his effectiveness as a brand ambassador."
Kroger,Jeffrey Dean Morgan,0.3,"While Jeffrey Dean Morgan has a strong public presence and appeal, his brand persona as a dramatic actor, often portraying villainous roles, may not align well with Kroger's focus on reliability, family values, and community connection."
Sephora,Jeffrey Dean Morgan,0.1,"Jeffrey Dean Morgan is primarily known for his acting roles and does not have a strong focus on beauty or skincare, which are essential for Sephora's brand criteria. His content lacks the beauty expertise and community engagement that Sephora seeks in influencers."
Nestle,Jeffrey Dean Morgan,0.45,"While Jeffrey Dean Morgan has a strong public presence and appeal, his brand image is more aligned with entertainment and dramatic roles rather than health, nutrition, and sustainability, which are key focuses for Nestle."
Lululemon,Jeffrey Dean Morgan,0.25,"While Jeffrey Dean Morgan is a well-known actor with a strong following, his public persona and roles, particularly as a villain in series like The Walking Dead, do not align with Lululemon's focus on wellness, mindfulness, and an active lifestyle."
Lyft,Jessica Alba,0.85,"Jessica Alba embodies a modern, tech-savvy lifestyle and has a strong focus on community and social impact through her work with The Honest Company, aligning well with Lyft's values of inclusivity and sustainability."
Redbull,Jessica Alba,0.25,"Jessica Alba's brand as an actress and entrepreneur does not strongly align with Redbull's extreme sports and adventurous lifestyle focus, and her recent personal challenges may detract from the energetic and bold image the brand seeks."
Kroger,Jessica Alba,0.75,"Jessica Alba embodies reliability and approachability through her brand, The Honest Company, which aligns with Kroger's focus on quality and family life. However, while she promotes healthy living, her recent personal challenges may affect her perceived authenticity and community connection."
Sephora,Jessica Alba,0.9,"Jessica Alba has a strong background in beauty through her brand, The Honest Company, and her public image aligns well with Sephora's focus on authenticity and inclusivity, making her a highly suitable influencer for the brand."
Nestle,Jessica Alba,0.75,"Jessica Alba's strong focus on health and wellness through her brand, The Honest Company, aligns well with Nestle's commitment to nutrition. However, her recent personal challenges may affect her perceived authenticity and trustworthiness in the eyes of consumers."
Lululemon,Jessica Alba,0.8,"Jessica Alba embodies an active lifestyle and has a strong focus on wellness through her brand, The Honest Company, which aligns well with Lululemon's values. However, her recent personal challenges may affect her perceived authenticity and engagement with the community."
Lyft,Jim Gaffigan,0.75,"Jim Gaffigan's clean comedy and family-oriented content resonate with a broad audience, aligning with Lyft's focus on community and inclusivity. However, while he embodies a modern lifestyle, his comedic style may not fully capture the tech-savvy and sustainability aspects that Lyft emphasizes."
Redbull,Jim Gaffigan,0.2,"Jim Gaffigan's comedic style focuses on observational humor and family life, lacking the extreme lifestyle and high-energy activities that align with Redbull's brand identity."
Kroger,Jim Gaffigan,0.75,"Jim Gaffigan's comedic focus on family life and food aligns well with Kroger's emphasis on everyday living and culinary expertise, though his recent edgy material may not fully resonate with the brand's family-oriented image."
Sephora,Jim Gaffigan,0.1,"Jim Gaffigan is primarily a comedian known for observational humor and family-related content, lacking a focus on beauty, skincare, or cosmetics, which are essential for Sephora's brand criteria."
Nestle,Jim Gaffigan,0.75,"Jim Gaffigan's clean comedy style and focus on family and food resonate well with Nestle's brand values, particularly in promoting health and nutrition. However, his recent controversies may affect his alignment with Nestle's emphasis on authenticity and trustworthiness."
Lululemon,Jim Gaffigan,0.3,"While Jim Gaffigan is a well-known comedian with a family-oriented and clean comedic style, his content primarily focuses on humor related to food, laziness, and parenting rather than an active, fitness-oriented lifestyle that aligns with Lululemon's brand values."
Lyft,Joanna Gaines,0.3,"While Joanna Gaines embodies a modern lifestyle and has a strong community presence, her focus on home decor and family life does not align closely with Lyft's urban mobility and tech-savvy image, limiting her effectiveness as a brand ambassador."
