brand,influencer,score,reason
Lululemon,Mark Ruffalo,0.75,"Mark Ruffalo embodies a mindful and active lifestyle, aligning with Lululemon's values, and has a strong commitment to sustainability and community engagement, though his primary focus is more on activism than fitness."
Lyft,Marsai Martin,0.75,"Marsai Martin embodies a modern, tech-savvy lifestyle and has a strong focus on inclusivity and community, which aligns well with Lyft's brand values. However, her content may not consistently emphasize sustainability and eco-friendly transportation options, which is a key criterion for Lyft."
Redbull,Marsai Martin,0.25,"Marsai Martin is primarily known for her acting and production work in family-friendly content, which does not align with Redbull's extreme sports and adventurous lifestyle branding. While she has a strong following and engages with her audience, her content does not resonate with the high-energy, adrenaline-fueled pursuits that Redbull embodies."
Kroger,Marsai Martin,0.75,"Marsai Martin embodies a youthful and diverse image that resonates with family values, making her relatable to Kroger's target audience. However, her primary focus on entertainment and production may not fully align with the culinary expertise and health focus that Kroger emphasizes."
Sephora,Marsai Martin,0.75,"Marsai Martin has a strong presence in the entertainment industry and is known for her creativity and innovation, which aligns well with Sephora's focus on beauty trends. However, her primary content does not heavily emphasize beauty expertise or community engagement in the beauty space, which slightly lowers her suitability."
Nestle,Marsai Martin,0.75,"Marsai Martin's influence as a young actress and producer aligns well with Nestle's focus on health, nutrition, and community engagement, but her content may not consistently emphasize sustainability and ethical practices, which are crucial for the brand."
Lululemon,Marsai Martin,0.6,"While Marsai Martin is a rising star and has a positive public image, her primary focus has been on acting and production rather than fitness or wellness, which may not align closely with Lululemon's core values."
Lyft,Martin Lawrence,0.45,"While Martin Lawrence has a strong urban appeal and a significant following, his past controversies and focus on comedy may not align with Lyft's emphasis on reliability, safety, and eco-friendliness."
Redbull,Martin Lawrence,0.25,"While Martin Lawrence is a well-known figure in entertainment, his brand does not align with the extreme sports and adventurous lifestyle that Redbull embodies, and his content primarily focuses on comedy and acting rather than high-energy activities."
Kroger,Martin Lawrence,0.3,"While Martin Lawrence is a well-known figure with a broad appeal, his brand as a comedian and actor does not strongly align with Kroger's focus on culinary expertise, health, and community connection, which are essential for their advertising strategy."
Sephora,Martin Lawrence,0.1,"Martin Lawrence is primarily known for his work in comedy and acting rather than beauty or skincare, lacking the necessary expertise and content style that aligns with Sephora's brand criteria."
Nestle,Martin Lawrence,0.25,"While Martin Lawrence has a broad appeal and a significant following, his past controversies and focus on entertainment rather than health and nutrition do not align well with Nestle's emphasis on authenticity, health, and sustainability."
Lululemon,Martin Lawrence,0.2,"Martin Lawrence's brand as a comedian and actor does not align with Lululemon's focus on wellness, yoga, and an active lifestyle, and his content lacks the authenticity and community engagement that the brand seeks."
Lyft,Nate Bargatze,0.75,"Nate Bargatze's clean and relatable comedy appeals to a broad audience, aligning with Lyft's inclusivity and community focus, but his primary content does not strongly emphasize urban mobility or sustainability."
Redbull,Nate Bargatze,0.2,"Nate Bargatze's clean and relatable comedy does not align with Redbull's extreme sports and high-energy lifestyle, and his content lacks the dynamic visual storytelling and adventurous spirit that the brand embodies."
Kroger,Nate Bargatze,0.75,"Nate Bargatze's clean and relatable comedy aligns well with Kroger's focus on family and community values, but his primary content does not emphasize culinary expertise or sustainability, which are key criteria for the brand."
Sephora,Nate Bargatze,0.2,"Nate Bargatze is primarily a stand-up comedian known for clean humor and relatable content, lacking a strong focus on beauty, skincare, or cosmetics, which are essential for Sephora's brand criteria."
Nestle,Nate Bargatze,0.75,"Nate Bargatze's clean and relatable comedy appeals to a broad audience, aligning with Nestle's focus on health and nutrition, but there is limited evidence of his commitment to sustainability and ethical practices."
Lululemon,Nate Bargatze,0.75,"Nate Bargatze's clean and relatable comedy aligns with Lululemon's values of wellness and community engagement, but his primary focus is on comedy rather than fitness or active living, which may limit his direct appeal to Lululemon's target audience."
Lyft,Ncuti Gatwa,0.75,"Ncuti Gatwa embodies a modern, tech-savvy lifestyle and has a diverse appeal, aligning well with Lyft's focus on inclusivity and community. However, his recent controversies may impact perceptions of reliability and trustworthiness."
Redbull,Ncuti Gatwa,0.25,"Ncuti Gatwa's persona is more aligned with acting and storytelling rather than extreme sports or high-energy activities, which are central to Redbull's brand identity. While he has a dynamic presence, his content does not primarily focus on the adventurous lifestyle that Redbull promotes."
Kroger,Ncuti Gatwa,0.45,"While Ncuti Gatwa has a diverse background and appeals to a broad audience, his recent focus on entertainment and personal projects may not align closely with Kroger's emphasis on culinary expertise, community connection, and everyday family life."
Sephora,Ncuti Gatwa,0.2,"Ncuti Gatwa is primarily known for his acting roles and does not have a strong focus on beauty or skincare content, which is essential for Sephora's brand criteria. Additionally, while he has a diverse background, his content does not consistently showcase beauty expertise or high-quality visual content that aligns with Sephora's premium aesthetic."
Nestle,Ncuti Gatwa,0.6,"Ncuti Gatwa's appeal as a prominent actor and his engagement with diverse communities align with Nestle's focus on inclusivity, but his recent controversies and the lack of a strong emphasis on health and nutrition in his public persona may hinder full alignment with the brand's values."
Lululemon,Ncuti Gatwa,0.75,"Ncuti Gatwa's active lifestyle and engagement with LGBTQ+ issues align with Lululemon's values of wellness and community, but his recent controversies and focus on entertainment may detract from the authenticity and fitness-centric content expected by the brand."
Lyft,Nicholas Braun,0.75,"Nicholas Braun's modern, tech-savvy image and his involvement in community-driven initiatives align well with Lyft's brand values, though his primary focus on acting may limit his engagement with urban mobility narratives."
Redbull,Nicholas Braun,0.3,Nicholas Braun is primarily known for his acting career and does not embody the extreme lifestyle or adventurous spirit that Redbull promotes; his content lacks the high-energy and adrenaline-fueled pursuits that align with the brand's identity.
Kroger,Nicholas Braun,0.6,"Nicholas Braun's approachable persona and connection to family-oriented content align with Kroger's values, but his primary focus on acting and entertainment may not strongly emphasize culinary expertise or sustainability."
Sephora,Nicholas Braun,0.2,"Nicholas Braun is primarily known as an actor and does not have a strong focus on beauty or skincare content, which is essential for Sephora's brand criteria. His lack of engagement in beauty trends and product knowledge limits his suitability for promoting a beauty brand."
Nestle,Nicholas Braun,0.75,"Nicholas Braun's broad appeal and recent focus on health-related content align well with Nestle's emphasis on nutrition and wellness, though his engagement with sustainability and community inclusivity could be more pronounced."
Lululemon,Nicholas Braun,0.45,"While Nicholas Braun has a strong public presence and has engaged in health-related initiatives, his primary focus as an actor does not strongly align with Lululemon's core values of wellness and active living, which may affect his authenticity in promoting the brand."
Lyft,Nicholas Hoult,0.75,"Nicholas Hoult embodies a modern lifestyle and has a diverse appeal, but his primary focus on film and acting may not directly align with Lyft's emphasis on urban mobility and community engagement."
Redbull,Nicholas Hoult,0.75,"Nicholas Hoult has a dynamic career in film and television, showcasing versatility and charisma, but his content does not primarily focus on extreme sports or high-energy activities, which are central to Redbull's brand identity."
Kroger,Nicholas Hoult,0.6,"Nicholas Hoult's appeal as a relatable figure and his philanthropic efforts align with Kroger's community values, but his focus on diverse roles in film may not directly emphasize culinary expertise or family-oriented content."
Sephora,Nicholas Hoult,0.2,"Nicholas Hoult is primarily known as an actor and does not have a strong focus on beauty or skincare content, which is essential for Sephora's brand criteria. His engagement with beauty trends and product knowledge appears limited, making him less suitable for this campaign."
Nestle,Nicholas Hoult,0.75,"Nicholas Hoult's diverse acting career and philanthropic efforts align well with Nestle's focus on community engagement and inclusivity, but his primary public persona does not strongly emphasize health and nutrition, which is crucial for the brand."
Lululemon,Nicholas Hoult,0.6,"Nicholas Hoult has a successful acting career and engages in philanthropy, but his public persona does not strongly emphasize an active, mindful lifestyle or fitness, which are core to Lululemon's brand values."
Lyft,Nick Offerman,0.6,"Nick Offerman's persona as a woodworker and humorist may not fully align with Lyft's tech-savvy and urban mobility focus, but his storytelling ability and community-oriented values could resonate with Lyft's inclusivity and social impact criteria."
Redbull,Nick Offerman,0.25,"While Nick Offerman is a well-known actor and embodies a unique personality, his brand identity is more aligned with humor, woodworking, and a laid-back lifestyle rather than the extreme sports and high-energy activities that Redbull promotes."
Kroger,Nick Offerman,0.75,"Nick Offerman embodies reliability and approachability, aligning with Kroger's values, and his emphasis on woodworking and outdoor life resonates with community connection. However, his primary focus is not on culinary expertise or health, which slightly limits his fit for Kroger's specific criteria."
Sephora,Nick Offerman,0.1,"Nick Offerman's expertise lies in acting and woodworking rather than beauty and cosmetics, making him largely unsuitable for Sephora's beauty-focused brand criteria."
Nestle,Nick Offerman,0.75,"Nick Offerman's emphasis on authenticity and quality aligns well with Nestle's values, and his diverse audience can help promote their wide range of products. However, his primary focus on woodworking and humor may not directly resonate with Nestle's health and nutrition emphasis."
Lululemon,Nick Offerman,0.3,"While Nick Offerman embodies a creative and active lifestyle, his primary focus on woodworking and humor does not align closely with Lululemon's emphasis on fitness, yoga, and wellness, which may limit his authenticity in promoting the brand."
Lyft,Paris Hilton,0.45,"While Paris Hilton embodies a modern lifestyle and has a significant social media presence, her past controversies and image as a party girl may not align with Lyft's focus on reliability, safety, and community inclusivity."
Redbull,Paris Hilton,0.25,"While Paris Hilton has a strong media presence and embodies a glamorous lifestyle, her brand does not align with the extreme sports and high-energy activities central to Redbull's identity, making her a less suitable fit for their advertising needs."
Kroger,Paris Hilton,0.25,"While Paris Hilton has a strong media presence and entrepreneurial spirit, her brand image as a socialite and party girl does not align well with Kroger's focus on reliability, community connection, and healthy living."
Sephora,Paris Hilton,0.75,"Paris Hilton has a strong presence in the beauty and fashion industry, with a history of launching successful beauty products and a visually appealing aesthetic, but her past controversies may detract from the authenticity and inclusivity that Sephora seeks."
Nestle,Paris Hilton,0.25,"While Paris Hilton has a significant global presence and engages diverse audiences, her brand image is more aligned with luxury and entertainment rather than health, nutrition, and sustainability, which are core values for Nestle."
Lululemon,Paris Hilton,0.25,"While Paris Hilton has a significant media presence and engages in various lifestyle ventures, her brand image is more aligned with luxury and celebrity culture rather than the active, mindful, and wellness-focused lifestyle that Lululemon promotes."
Lyft,Patrick Dempsey,0.75,"Patrick Dempsey embodies a modern lifestyle and has a strong public image, but his primary focus on acting and racing may not fully align with Lyft's emphasis on urban mobility and sustainability."
Redbull,Patrick Dempsey,0.75,"Patrick Dempsey's involvement in auto racing and his adventurous lifestyle align well with Redbull's brand identity, but his primary recognition comes from acting rather than extreme sports, which may limit his authenticity in this specific niche."
Kroger,Patrick Dempsey,0.6,"Patrick Dempsey's appeal as a relatable figure and his connection to family life align with Kroger's brand values, but his primary focus on acting and racing may not strongly emphasize culinary expertise or community connection."
Sephora,Patrick Dempsey,0.2,"Patrick Dempsey is primarily known for his acting and racing career, lacking a strong focus on beauty, skincare, or cosmetics, which are essential for Sephora's brand criteria."
Nestle,Patrick Dempsey,0.75,"Patrick Dempsey's public persona as a health-conscious individual and his involvement in philanthropy align well with Nestle's focus on nutrition and community engagement, though his primary brand associations have been more entertainment and automotive rather than food and wellness."
Lululemon,Patrick Dempsey,0.75,"Patrick Dempsey embodies an active lifestyle through his involvement in auto racing and has a strong public image, but his primary focus is on acting rather than fitness or wellness, which may not fully align with Lululemon's core values."
Lyft,Pink Floyd,0.1,"Pink Floyd, as a legendary rock band, does not embody the modern, tech-savvy lifestyle or urban mobility focus that Lyft seeks; their brand identity is more aligned with music and cultural commentary than with contemporary urban transportation."
Redbull,Pink Floyd,0.1,"Pink Floyd, as a legendary rock band, does not embody the extreme sports and high-energy lifestyle that Redbull promotes; their themes are more philosophical and introspective, lacking the adventurous spirit required for effective brand alignment."
Kroger,Pink Floyd,0.0,"Pink Floyd, as a legendary rock band, does not align with Kroger's focus on everyday family life, culinary expertise, and community connection, making them unsuitable for the brand's advertising needs."
Sephora,Pink Floyd,0.0,"Pink Floyd is a legendary rock band known for their music and artistic contributions, not for beauty or skincare expertise, making them unsuitable for Sephora's influencer marketing criteria."
Nestle,Pink Floyd,0.0,"Pink Floyd, as a rock band known for their psychedelic and progressive music, does not align with Nestle's focus on health, nutrition, and sustainability, making them unsuitable for promoting the brand."
Lululemon,Pink Floyd,0.0,"Pink Floyd, as a legendary rock band, does not embody the active, mindful, and wellness-focused lifestyle that Lululemon promotes, making them unsuitable for the brand's influencer marketing strategy."
Lyft,Priyanka Chopra,0.85,"Priyanka Chopra embodies a modern, tech-savvy lifestyle and has a strong focus on social impact and inclusivity, aligning well with Lyft's brand values. Her extensive reach and ability to engage diverse audiences further enhance her suitability for promoting Lyft's services."
Redbull,Priyanka Chopra,0.45,"While Priyanka Chopra is a globally recognized figure with a dynamic career, her brand image is more aligned with mainstream entertainment and philanthropy rather than the extreme sports and adventurous lifestyle that Redbull embodies."
Kroger,Priyanka Chopra,0.75,"Priyanka Chopra embodies a diverse and inclusive image, has a strong community connection through her philanthropic work, and promotes healthy living, but her celebrity status may not fully align with Kroger's focus on everyday reliability and approachability."
Sephora,Priyanka Chopra,0.95,"Priyanka Chopra has a strong background in beauty and fashion, extensive experience in the entertainment industry, and a diverse audience, making her a highly suitable influencer for Sephora's brand ethos of authenticity and inclusivity."
Nestle,Priyanka Chopra,0.85,"Priyanka Chopra's strong advocacy for health, nutrition, and women's empowerment aligns well with Nestle's focus on balanced diets and community engagement, while her global appeal enhances brand reach. However, her past endorsements of skin-lightening products may raise concerns about authenticity and trustworthiness."
Lululemon,Priyanka Chopra,0.9,"Priyanka Chopra embodies an active and balanced lifestyle, promotes wellness and fitness, and has a strong commitment to social causes, aligning well with Lululemon's values. Her high-quality content and engaged audience further enhance her suitability as a brand ambassador."
Lyft,Rainn Wilson,0.75,"Rainn Wilson's modern, tech-savvy persona and commitment to social impact align well with Lyft's values, particularly in sustainability and community focus. However, his primary recognition comes from entertainment rather than direct urban mobility advocacy, which slightly limits his fit."
Redbull,Rainn Wilson,0.3,"While Rainn Wilson is a well-known actor and has a vibrant personality, his content and lifestyle do not align closely with Redbull's extreme sports and high-energy brand ethos, which may limit his effectiveness as an influencer for this brand."
Kroger,Rainn Wilson,0.75,"Rainn Wilson's approachable persona and commitment to community values align well with Kroger's focus on family life and local connection, though his emphasis on sustainability and culinary expertise may not be as pronounced in his public image."
Sephora,Rainn Wilson,0.2,"Rainn Wilson is primarily known for his acting and comedic roles rather than beauty expertise, and his content does not focus on beauty or skincare trends, which are essential for Sephora's brand criteria."
Nestle,Rainn Wilson,0.75,"Rainn Wilson's commitment to sustainability and community engagement aligns well with Nestle's values, but his primary focus on entertainment and personal projects may not fully reflect the health and nutrition emphasis that Nestle seeks."
Lululemon,Rainn Wilson,0.75,"Rainn Wilson embodies a mindful lifestyle and has a strong commitment to sustainability, aligning well with Lululemon's values. However, his primary public persona is more comedic and entertainment-focused, which may not fully resonate with Lululemon's premium and fitness-oriented brand image."
Lyft,Rob Gronkowski,0.75,"Rob Gronkowski embodies a fun, modern lifestyle that aligns with Lyft's urban mobility focus, but his party-centric persona may not fully convey the reliability and safety aspects that Lyft prioritizes."
Redbull,Rob Gronkowski,0.9,"Rob Gronkowski embodies a bold and adventurous lifestyle, aligning well with Redbull's extreme sports ethos, and his energetic personality resonates with the brand's identity. His extensive engagement in sports and entertainment, along with a strong social media presence, enhances his suitability as a dynamic storyteller for the brand."
Kroger,Rob Gronkowski,0.45,"While Rob Gronkowski is a well-known personality and has a fun, approachable image, his brand does not strongly align with Kroger's focus on culinary expertise, healthy eating, and community connection, which are essential for the brand's messaging."
Sephora,Rob Gronkowski,0.0,"Rob Gronkowski's background as a former NFL player and his focus on sports and entertainment do not align with Sephora's criteria for beauty expertise, trendsetting, and authentic engagement in the beauty community."
Nestle,Rob Gronkowski,0.3,"While Rob Gronkowski has a strong public persona and a diverse audience, his brand image as a party-loving athlete may not align well with Nestle's focus on health, nutrition, and sustainability."
Lululemon,Rob Gronkowski,0.75,"Rob Gronkowski embodies an active lifestyle and has a strong presence in fitness and sports, but his party-centric persona may not fully align with Lululemon's focus on mindfulness and community engagement."
Lyft,Rosal_a,0.75,"Rosala embodies a modern, tech-savvy lifestyle and has a strong urban appeal, aligning well with Lyft's focus on innovative urban mobility. However, her primary brand associations and artistic persona may not fully emphasize reliability and community focus as Lyft requires."
Redbull,Rosal_a,0.45,"While Rosala is a dynamic and innovative artist with a strong following, her brand identity is more aligned with music and cultural expression rather than extreme sports and high-energy activities, which may not resonate strongly with Redbull's adventurous ethos."
Kroger,Rosal_a,0.25,"While Rosala is a highly influential artist with a diverse appeal, her brand image and content focus on music and performance do not align closely with Kroger's emphasis on everyday family life, culinary expertise, and community connection."
Sephora,Rosal_a,0.85,"Rosala has a strong presence in the beauty and fashion space, demonstrated by her collaborations with brands like MAC and Skims, and her visually compelling content aligns well with Sephora's high-fashion aesthetic. However, her primary focus is on music rather than beauty, which may limit her engagement with Sephora's specific beauty community."
Nestle,Rosal_a,0.45,"While Rosala has a strong global presence and engages diverse audiences, her brand image is more aligned with music and fashion rather than health and nutrition, which may not resonate with Nestl's focus on balanced diets and wellness."
Lululemon,Rosal_a,0.25,"While Rosala is a prominent figure in the music industry and has a strong visual aesthetic, her brand image primarily revolves around music and cultural expression rather than the active, wellness-focused lifestyle that Lululemon promotes."
Lyft,Ryan Seacrest,0.85,"Ryan Seacrest embodies a modern, tech-savvy lifestyle and has a broad appeal, making him suitable for Lyft's urban mobility focus. However, while he promotes community and inclusivity, his content may not consistently emphasize sustainability and eco-friendly initiatives."
Redbull,Ryan Seacrest,0.3,"While Ryan Seacrest is a well-known figure in entertainment, his brand does not align with the extreme sports and adventurous lifestyle that Redbull embodies, which may limit his effectiveness in authentically promoting the brand."
Kroger,Ryan Seacrest,0.75,"Ryan Seacrest's broad appeal and established presence in media align well with Kroger's focus on community and family life, but his content may not consistently emphasize culinary expertise or sustainability, which are key brand criteria."
Sephora,Ryan Seacrest,0.25,"While Ryan Seacrest is a well-known media personality with a broad audience, he lacks a specific focus on beauty and skincare, which are crucial for Sephora's brand criteria. His content does not consistently reflect the beauty expertise and trendsetting required for effective promotion in this niche."
Nestle,Ryan Seacrest,0.75,"Ryan Seacrest's broad appeal and established presence in media align well with Nestle's diverse product portfolio, but his focus on entertainment may not fully emphasize health and nutrition, which is crucial for the brand."
Lululemon,Ryan Seacrest,0.6,"Ryan Seacrest is a well-known media personality with a broad audience, but his primary focus is on entertainment rather than fitness or wellness, which may not fully align with Lululemon's core values of an active and mindful lifestyle."
Lyft,Scott Eastwood,0.75,"Scott Eastwood embodies a modern lifestyle and has a broad appeal, but his focus on action and drama in his film roles may not fully align with Lyft's emphasis on community and eco-friendliness."
Redbull,Scott Eastwood,0.75,"Scott Eastwood embodies an adventurous lifestyle and has experience in high-energy films, aligning well with Redbull's brand identity; however, his engagement with extreme sports communities is less prominent, which slightly lowers his suitability."
Kroger,Scott Eastwood,0.45,"Scott Eastwood's celebrity status and appeal may resonate with a broad audience, but his content does not strongly align with Kroger's focus on everyday family life, culinary expertise, and community connection."
Sephora,Scott Eastwood,0.2,"Scott Eastwood is primarily known as an actor and producer, with no evident strong passion or expertise in beauty, skincare, or cosmetics, which are crucial for Sephora's brand criteria."
