brand,influencer,score,reason
Sephora,Bryan Cranston,0.1,"Bryan Cranston is primarily known for his acting career and does not have a strong focus on beauty or skincare, which are essential for Sephora's brand criteria. His content lacks the beauty expertise and trendsetting qualities that Sephora seeks in influencers."
Nestle,Bryan Cranston,0.75,"Bryan Cranston's strong public persona and commitment to quality align well with Nestle's values, but his past roles, particularly in 'Breaking Bad', may conflict with the brand's focus on health and nutrition."
Lululemon,Bryan Cranston,0.2,"While Bryan Cranston is a highly respected actor with a strong public presence, his content does not primarily focus on health, fitness, or an active lifestyle, which are core values of Lululemon. Additionally, his recent roles and public persona do not strongly align with the brand's emphasis on wellness and community engagement."
Lyft,Cardi B,0.75,"Cardi B's vibrant urban persona and strong social media presence align well with Lyft's focus on modern, tech-savvy lifestyles and community engagement, though her controversial past may raise concerns about reliability and trustworthiness."
Redbull,Cardi B,0.6,"While Cardi B embodies a bold and energetic persona, her primary focus is on music and entertainment rather than extreme sports or adventurous lifestyles, which may not fully align with Redbull's core identity."
Kroger,Cardi B,0.25,"While Cardi B has a strong influence and diverse appeal, her brand image and content focus on personal expression and entertainment do not align well with Kroger's emphasis on reliability, family-oriented values, and culinary expertise."
Sephora,Cardi B,0.85,"Cardi B has a strong presence in the beauty and fashion space, showcasing her passion for cosmetics and trends, which aligns well with Sephora's brand ethos. However, her often controversial public persona may not fully resonate with Sephora's emphasis on authenticity and inclusivity."
Nestle,Cardi B,0.25,"While Cardi B has a significant following and influence, her brand image and content often focus on themes of empowerment and personal expression rather than health, nutrition, and sustainability, which are key criteria for Nestle."
Lululemon,Cardi B,0.25,"While Cardi B has a strong influence and a large following, her public persona and content focus on a lifestyle that often contrasts with Lululemon's emphasis on wellness, yoga, and mindfulness, making her less suitable for the brand."
Lyft,Charli D'Amelio,0.85,"Charli D'Amelio embodies a modern, tech-savvy lifestyle and has a strong connection with a diverse audience, making her a good fit for Lyft's focus on urban mobility and community. However, her past controversies may raise concerns about reliability and trustworthiness."
Redbull,Charli D'Amelio,0.3,"While Charli D'Amelio has a massive following and engages with a youthful audience, her content primarily focuses on dance and lifestyle rather than extreme sports or high-energy activities, which are central to Redbull's brand identity."
Kroger,Charli D'Amelio,0.75,"Charli D'Amelio's relatable and authentic content resonates well with Kroger's focus on family and community values, but her primary association with entertainment and social media may not fully align with the brand's culinary and health focus."
Sephora,Charli D'Amelio,0.9,"Charli D'Amelio has a strong presence in the beauty space with her makeup line and collaborations, showcasing her passion for beauty and trendsetting. Her large following and engagement levels align well with Sephora's criteria for authenticity, inclusivity, and community building."
Nestle,Charli D'Amelio,0.75,"Charli D'Amelio has a strong global appeal and engages a diverse audience, aligning well with Nestle's brand criteria. However, her past controversies and focus on entertainment may not fully emphasize health and nutrition, which is crucial for Nestle's messaging."
Lululemon,Charli D'Amelio,0.75,"Charli D'Amelio embodies an active lifestyle and has a strong presence in the wellness and fitness community, but her content primarily focuses on entertainment and trends rather than the deeper values of mindfulness and sustainability that Lululemon emphasizes."
Lyft,Chris Brown,0.25,"Chris Brown's controversial past, including legal issues and public perception challenges, may undermine Lyft's emphasis on reliability and trustworthiness, despite his broad appeal and engagement potential."
Redbull,Chris Brown,0.25,"While Chris Brown has a dynamic presence and engages a large audience, his past controversies and legal issues, particularly related to violence, conflict with Redbull's brand alignment of promoting a positive, adventurous lifestyle."
Kroger,Chris Brown,0.25,"Chris Brown's controversial past, including legal issues and a history of domestic violence, undermines his alignment with Kroger's values of reliability and community connection, despite his broad appeal and popularity."
Sephora,Chris Brown,0.2,"Chris Brown's brand image is heavily influenced by past controversies, particularly related to violence and legal issues, which may conflict with Sephora's emphasis on authenticity and inclusivity in beauty. Additionally, while he has a strong following, his content does not primarily focus on beauty or skincare, making him less suitable for a brand that prioritizes beauty expertise."
Nestle,Chris Brown,0.25,"Chris Brown's controversial past, including legal issues and a history of violence, undermines the authenticity and trustworthiness that Nestle seeks in influencers, particularly in promoting health and nutrition-focused products."
Lululemon,Chris Brown,0.2,"Chris Brown's public persona and past controversies, particularly related to violence and legal issues, do not align with Lululemon's emphasis on wellness, mindfulness, and community engagement, making him a poor fit for the brand."
Lyft,Chris Pratt,0.75,"Chris Pratt embodies a modern lifestyle and has a broad appeal, but his recent controversies may detract from the inclusivity and community focus that Lyft seeks in its influencers."
Redbull,Chris Pratt,0.75,"Chris Pratt embodies a dynamic and adventurous persona through his roles in action-packed films and his public image, aligning well with Redbull's extreme lifestyle. However, his content may not consistently focus on extreme sports or high-energy activities, which slightly lowers his suitability."
Kroger,Chris Pratt,0.75,"Chris Pratt has a strong public image and relatability, which aligns with Kroger's focus on family and community. However, his recent controversies and lack of a clear culinary focus may limit his effectiveness in promoting healthy eating and sustainability."
Sephora,Chris Pratt,0.2,"Chris Pratt is primarily known as an actor and does not have a strong focus on beauty or skincare, which are essential for Sephora's brand criteria. His content lacks the beauty expertise and community engagement that Sephora seeks in influencers."
Nestle,Chris Pratt,0.75,"Chris Pratt has a broad appeal and a diverse portfolio, aligning well with Nestle's global audience. However, his past controversies and public image may raise questions about authenticity and trustworthiness, which are crucial for Nestle's brand values."
Lululemon,Chris Pratt,0.6,"While Chris Pratt has a strong public image and engages in fitness-related roles, his recent controversies and mixed public perception may detract from Lululemon's emphasis on authenticity and community engagement."
Lyft,Christina Aguilera,0.75,"Christina Aguilera embodies a modern, tech-savvy lifestyle and has a strong community focus, making her a good fit for Lyft's brand values. However, her past controversies and focus on personal narratives may not align perfectly with Lyft's emphasis on reliability and eco-friendliness."
Redbull,Christina Aguilera,0.25,"While Christina Aguilera is a highly influential artist with a strong fanbase, her brand identity does not align with Redbull's focus on extreme sports and adventure, which may limit her effectiveness in authentically promoting the brand."
Kroger,Christina Aguilera,0.75,"Christina Aguilera's strong community connection and advocacy for social issues align well with Kroger's values, but her celebrity status may not fully resonate with the everyday reliability and approachability that the brand seeks."
Sephora,Christina Aguilera,0.9,"Christina Aguilera's extensive experience in the beauty and fashion industry, combined with her strong engagement with diverse audiences and her history of promoting beauty products, aligns well with Sephora's criteria for authenticity, inclusivity, and trendsetting."
Nestle,Christina Aguilera,0.75,"Christina Aguilera's strong global presence and commitment to social causes align well with Nestle's focus on community engagement and inclusivity, but her past controversies and emphasis on personal expression may not fully resonate with Nestle's health and nutrition focus."
Lululemon,Christina Aguilera,0.75,"Christina Aguilera embodies a strong personal brand with a focus on wellness and empowerment, aligning well with Lululemon's values; however, her primary identity as a pop icon may not fully resonate with Lululemon's target audience of fitness enthusiasts."
Lyft,Coca Cola,0.0,"Coca-Cola is a beverage brand and not an influencer, making it entirely unsuitable for promoting Lyft, which focuses on urban mobility and connectivity."
Redbull,Coca Cola,0.0,"Coca-Cola, as a brand, does not align with Redbull's extreme lifestyle and adventurous ethos, making it unsuitable for promoting Redbull's identity focused on extreme sports and high-energy activities."
Kroger,Coca Cola,0.0,"Coca-Cola, as a brand, does not align with Kroger's focus on everyday family life, culinary expertise, and community connection, making it unsuitable for promoting Kroger's values."
Sephora,Coca Cola,0.0,"Coca-Cola is a beverage brand and does not align with Sephora's focus on beauty, skincare, and cosmetics, making it unsuitable for their influencer marketing criteria."
Nestle,Coca Cola,0.0,"Coca-Cola, as an influencer, does not align with Nestle's focus on health, nutrition, and sustainability, and is primarily known for sugary beverages, which contradicts Nestle's commitment to balanced diets and wellness."
Lululemon,Coca Cola,0.0,"Coca-Cola, as a global beverage brand, does not align with Lululemon's focus on wellness, yoga, and sustainable active living, making it unsuitable for their influencer marketing strategy."
Lyft,Common,0.85,"Common embodies a modern, tech-savvy lifestyle and has a strong focus on community and social impact, aligning well with Lyft's values. His diverse audience and storytelling ability enhance his suitability for promoting Lyft's services."
Redbull,Common,0.3,"While Common is a well-respected artist with a strong presence in music and activism, his brand identity does not align closely with Redbull's focus on extreme sports and high-energy activities, which may limit his effectiveness as a brand ambassador."
Kroger,Common,0.75,"Common's authenticity and community connection align well with Kroger's values, but his focus on social issues and activism may not directly emphasize culinary expertise and health, which are key for the brand."
Sephora,Common,0.25,"While Common has a strong presence and influence, his primary focus is on music and activism rather than beauty and cosmetics, which may not align well with Sephora's criteria for beauty expertise and trendsetting."
Nestle,Common,0.75,"Common's focus on health, nutrition, and community engagement aligns well with Nestle's brand values, but his strong activism and past controversies may not fully resonate with all consumer demographics."
Lululemon,Common,0.75,"Common embodies a mindful and balanced lifestyle through his activism and commitment to social issues, which aligns with Lululemon's values; however, his primary focus is on music and acting rather than fitness or wellness, which may limit his direct appeal to Lululemon's target audience."
Lyft,Craig Robinson,0.75,"Craig Robinson's urban lifestyle and comedic appeal align well with Lyft's focus on modern, tech-savvy transportation, but his primary brand associations are more entertainment-focused rather than sustainability or community initiatives."
Redbull,Craig Robinson,0.3,"While Craig Robinson is a well-known actor and comedian with a vibrant personality, his content primarily focuses on comedy and entertainment rather than extreme sports or high-energy activities, which are central to Redbull's brand identity."
Kroger,Craig Robinson,0.75,"Craig Robinson's approachable persona and experience in family-oriented commercials align well with Kroger's focus on reliability and community connection, though his primary content does not heavily emphasize culinary expertise or sustainability."
Sephora,Craig Robinson,0.2,"Craig Robinson is primarily known for his work in comedy and acting rather than beauty or skincare, lacking the specific expertise and trendsetting qualities that Sephora seeks in influencers."
Nestle,Craig Robinson,0.75,"Craig Robinson's diverse background in entertainment and previous collaborations with brands like Dietz & Watson and Pizza Hut suggest he can effectively engage a wide audience. However, while he has a comedic and approachable persona, his focus on health and nutrition may not be as prominent, which is crucial for Nestle's brand alignment."
Lululemon,Craig Robinson,0.3,"While Craig Robinson is a well-known actor and comedian, his content does not primarily focus on health, fitness, or the active lifestyle that Lululemon promotes, which may hinder alignment with the brand's core values."
Lyft,Cynthia Erivo,0.85,"Cynthia Erivo embodies a modern, tech-savvy lifestyle and has a strong focus on inclusivity and social impact, aligning well with Lyft's values. Her diverse audience and storytelling ability enhance her suitability for promoting Lyft's urban mobility and community initiatives."
Redbull,Cynthia Erivo,0.3,"Cynthia Erivo is primarily known for her achievements in theater and film, focusing on dramatic roles and musical performances rather than extreme sports or high-energy activities, which may not align well with Redbull's adventurous brand identity."
Kroger,Cynthia Erivo,0.75,"Cynthia Erivo's authenticity and community connection align well with Kroger's values, and her diverse background can appeal to a broad customer base. However, her primary focus on performance and entertainment may not fully resonate with the culinary expertise and everyday living aspects that Kroger emphasizes."
Sephora,Cynthia Erivo,0.85,"Cynthia Erivo has a strong presence in the beauty and fashion space, showcasing her diverse looks and styles, which aligns well with Sephora's focus on authenticity and inclusivity. Her high-quality visual content and engagement with her audience further enhance her suitability as a brand ambassador."
Nestle,Cynthia Erivo,0.75,"Cynthia Erivo's strong emphasis on authenticity, community engagement, and her diverse background aligns well with Nestle's values, though her focus on health and nutrition may not be as prominent in her content."
Lululemon,Cynthia Erivo,0.75,"Cynthia Erivo embodies a strong commitment to wellness and personal growth through her artistic endeavors and advocacy, aligning well with Lululemon's values, though her primary focus is on acting and music rather than fitness specifically."
Lyft,DJ Khaled,0.75,"DJ Khaled embodies a modern lifestyle and has a strong social media presence, which aligns with Lyft's focus on urban mobility and community engagement. However, his brand is more centered around music and entertainment rather than transportation, which may dilute the message of reliability and sustainability that Lyft seeks."
Redbull,DJ Khaled,0.75,"DJ Khaled embodies a high-energy lifestyle and has a strong presence in music and social media, which aligns well with Redbull's adventurous brand identity; however, his primary focus is on music rather than extreme sports, which slightly limits his fit."
Kroger,DJ Khaled,0.3,DJ Khaled's persona is more aligned with entertainment and music rather than the everyday reliability and community connection that Kroger seeks; his focus on luxury and celebrity culture may not resonate with Kroger's target audience.
Sephora,DJ Khaled,0.2,"DJ Khaled is primarily known for his music and entertainment career rather than beauty expertise, which does not align with Sephora's focus on beauty and skincare trends. His content lacks the authenticity and product knowledge required for a beauty brand partnership."
Nestle,DJ Khaled,0.45,"While DJ Khaled has a strong social media presence and engages a diverse audience, his brand persona is more aligned with entertainment and lifestyle rather than health and nutrition, which may not resonate with Nestle's focus on balanced diets and sustainability."
Lululemon,DJ Khaled,0.25,"DJ Khaled's brand persona is more aligned with entertainment and music rather than the active, mindful lifestyle that Lululemon promotes, which may lead to a disconnect in authenticity and community engagement."
Lyft,David Portnoy,0.25,"David Portnoy's controversial persona and history of divisive comments do not align with Lyft's emphasis on reliability, trustworthiness, and inclusivity, making him a poor fit for the brand's image."
Redbull,David Portnoy,0.25,"While Dave Portnoy has a strong online presence and engages a large audience, his controversial persona and focus on bro culture do not align well with Redbull's adventurous and extreme sports identity."
Kroger,David Portnoy,0.1,"David Portnoy's persona and content focus on bro culture and controversial humor do not align with Kroger's values of reliability, community connection, and healthy living, making him a poor fit for the brand."
Sephora,David Portnoy,0.1,"David Portnoy's content primarily focuses on sports and pizza reviews, lacking the beauty expertise and trendsetting qualities that Sephora seeks in an influencer. Additionally, his controversial public persona may not align with Sephora's values of authenticity and inclusivity."
Nestle,David Portnoy,0.1,"David Portnoy's controversial persona and focus on bro culture do not align with Nestle's emphasis on health, nutrition, and ethical practices, making him a poor fit for the brand's values."
Lululemon,David Portnoy,0.1,"David Portnoy's persona and content focus on bro culture, sports, and pizza reviews, which do not align with Lululemon's emphasis on wellness, yoga, and a mindful lifestyle."
Lyft,Diplo,0.6,"Diplo's modern, tech-savvy lifestyle and extensive reach in urban music culture align with Lyft's focus on urban mobility, but his recent controversies may undermine the reliability and trustworthiness that Lyft seeks in its influencers."
Redbull,Diplo,0.85,"Diplo embodies a bold and adventurous lifestyle, aligning well with Redbull's extreme sports ethos, and his dynamic visual storytelling resonates with the brand's energetic identity. However, recent controversies may impact his overall suitability."
Kroger,Diplo,0.25,"Diplo's brand persona as a DJ and music producer does not align with Kroger's focus on family-oriented, everyday living and culinary expertise, and his recent controversies may detract from the authenticity and community connection that Kroger seeks."
Sephora,Diplo,0.25,"While Diplo has a significant following and experience in the music industry, he lacks a strong focus on beauty, skincare, and cosmetics, which are essential for Sephora's brand criteria. His content does not align with the beauty expertise and trendsetting that Sephora seeks."
Nestle,Diplo,0.25,"Diplo's brand image is heavily associated with the music and entertainment industry, which may not align with Nestle's focus on health, nutrition, and sustainability. Additionally, recent allegations against him could undermine the authenticity and trustworthiness that Nestle seeks in its influencers."
Lululemon,Diplo,0.25,"While Diplo has a significant following and is involved in various music projects, his brand image and lifestyle do not align closely with Lululemon's focus on wellness, yoga, and community engagement, which may hinder authenticity and credibility in promoting the brand."
Lyft,Ed Helms,0.75,"Ed Helms embodies a modern, tech-savvy lifestyle and has a strong connection to urban culture through his work, making him a good fit for Lyft's focus on urban mobility. However, while he promotes community and inclusivity, his content may not consistently emphasize sustainability and eco-friendly initiatives, which are key criteria for Lyft."
Redbull,Ed Helms,0.3,"While Ed Helms is a well-known actor and comedian, his brand persona does not strongly align with Redbull's extreme sports and high-energy lifestyle, which may limit his effectiveness in authentically promoting the brand."
Kroger,Ed Helms,0.75,"Ed Helms embodies a relatable and approachable persona, aligning well with Kroger's focus on family life and community connection. However, while he has a diverse background, his content does not consistently emphasize culinary expertise or sustainability, which are key criteria for the brand."
Sephora,Ed Helms,0.2,"Ed Helms is primarily known for his work in comedy and acting rather than beauty or skincare, lacking the specific expertise and passion for beauty trends that Sephora seeks in influencers."
Nestle,Ed Helms,0.75,"Ed Helms has a broad appeal and a strong comedic background, which aligns well with Nestle's diverse product portfolio. However, while he has shown engagement in community and political issues, his direct focus on health, nutrition, and sustainability in his content is less prominent, which may affect his overall fit for the brand's specific criteria."
Lululemon,Ed Helms,0.45,"While Ed Helms has a comedic background and has engaged in various entertainment projects, his content does not strongly align with Lululemon's focus on wellness, yoga, and an active lifestyle, which may limit his effectiveness as a brand ambassador."
Lyft,Elizabeth Banks,0.75,"Elizabeth Banks embodies a modern, tech-savvy lifestyle and has a strong presence in urban-centric narratives, making her a good fit for Lyft's focus on urban mobility and community. However, her recent projects do not heavily emphasize sustainability or eco-friendly initiatives, which slightly lowers her overall suitability."
Redbull,Elizabeth Banks,0.3,"While Elizabeth Banks is a well-known actress and director, her brand persona does not strongly align with Redbull's extreme sports and high-energy lifestyle, which may limit her effectiveness in authentically promoting the brand."
Kroger,Elizabeth Banks,0.75,"Elizabeth Banks embodies approachability and has a strong connection to family and community, which aligns well with Kroger's values. However, her focus on entertainment and film may not fully emphasize culinary expertise and health, slightly limiting her fit for the brand."
Sephora,Elizabeth Banks,0.75,"Elizabeth Banks has a strong presence in the entertainment industry and has previously engaged in beauty-related advertising, but her primary focus is not solely on beauty, skincare, or cosmetics, which may limit her alignment with Sephora's specific criteria."
Nestle,Elizabeth Banks,0.75,"Elizabeth Banks has a strong public persona and a diverse portfolio that aligns with Nestle's wide range of products. However, while she promotes healthy lifestyles, her recent projects may not consistently emphasize nutrition and sustainability, which are key criteria for Nestle."
Lululemon,Elizabeth Banks,0.75,"Elizabeth Banks embodies a balanced lifestyle and has a strong presence in the entertainment industry, but her content does not consistently focus on health and fitness, which is crucial for Lululemon's brand alignment."
Lyft,Emma Chamberlain,0.85,"Emma Chamberlain embodies a modern, tech-savvy lifestyle and has a strong connection with a diverse audience, making her a good fit for Lyft's focus on urban mobility and community. Her emphasis on authenticity and storytelling aligns well with Lyft's brand values, although her primary content focus is not directly related to transportation."
Redbull,Emma Chamberlain,0.35,"Emma Chamberlain's content primarily focuses on lifestyle, fashion, and personal experiences rather than extreme sports or high-energy activities, which are central to Redbull's brand identity. While she has a strong following and engages her audience, her alignment with the adventurous and adrenaline-fueled ethos of Redbull is limited."
Kroger,Emma Chamberlain,0.75,"Emma Chamberlain's relatable and authentic content aligns well with Kroger's focus on everyday living and community connection, but her primary brand identity is more centered around fashion and lifestyle rather than culinary expertise and health, which may limit her fit for Kroger's specific criteria."
Sephora,Emma Chamberlain,0.85,"Emma Chamberlain has a strong presence in the beauty and fashion space, showcasing authenticity and inclusivity in her content, which aligns well with Sephora's brand ethos. However, while she engages her audience effectively, her primary focus has been on lifestyle and coffee rather than exclusively on beauty, which slightly lowers her suitability."
Nestle,Emma Chamberlain,0.75,"Emma Chamberlain's strong focus on health and wellness through her coffee brand aligns well with Nestle's commitment to nutrition, while her authenticity and large, engaged audience enhance her suitability. However, her past controversies and the specific focus on diverse Nestle products may limit her overall fit."
