brand,influencer,score,reason
Lyft,Aaron Paul,0.75,"Aaron Paul embodies a modern lifestyle and has a strong public persona that aligns with Lyft's focus on urban mobility and community. However, while he has a diverse appeal, his past roles may not fully emphasize the reliability and eco-friendly aspects that Lyft prioritizes."
Redbull,Aaron Paul,0.6,"While Aaron Paul is a well-known actor with a dynamic presence, his brand alignment with Redbull's extreme lifestyle and adventurous ethos is not as strong, as his most recognized roles do not directly relate to extreme sports or high-energy activities."
Kroger,Aaron Paul,0.45,"While Aaron Paul has a strong public persona and a connection to family-oriented content through his roles, he lacks a direct focus on culinary expertise, healthy eating, and community connection that Kroger emphasizes, which may limit his alignment with the brand's core values."
Sephora,Aaron Paul,0.2,"While Aaron Paul is a well-known actor with a strong following, he lacks a demonstrated passion for beauty and cosmetics, which are essential for Sephora's brand criteria. His content does not align with the beauty expertise and trendsetting focus that Sephora seeks in its influencers."
Nestle,Aaron Paul,0.6,"Aaron Paul's public persona and roles often emphasize themes of rebellion and complexity, which may not align with Nestle's focus on health, nutrition, and family-friendly values. However, his broad appeal and engagement with diverse audiences could still resonate with some of Nestle's product lines."
Lululemon,Aaron Paul,0.45,"While Aaron Paul is a well-known actor with a strong following, his public persona is more aligned with dramatic roles and entertainment rather than a consistent focus on wellness, fitness, or the active lifestyle that Lululemon promotes."
Lyft,Akon,0.75,"Akon's influence in urban culture and his philanthropic efforts align well with Lyft's focus on community and social impact, but his past controversies may raise concerns about reliability and trustworthiness."
Redbull,Akon,0.6,"While Akon has a dynamic career in music and philanthropy, his brand does not strongly align with the extreme sports and adventurous lifestyle that Redbull embodies, which may limit his effectiveness in authentically promoting the brand."
Kroger,Akon,0.45,"While Akon has a strong global presence and philanthropic initiatives, his brand image is more aligned with entertainment and music rather than the family-oriented, culinary, and community-focused values that Kroger emphasizes."
Sephora,Akon,0.2,"Akon's primary focus is music and philanthropy rather than beauty or skincare, which does not align with Sephora's criteria for beauty expertise and trendsetting. Additionally, his content does not typically reflect the high-quality visual aesthetic or community engagement expected by the brand."
Nestle,Akon,0.45,"While Akon has a significant global presence and philanthropic efforts, his past controversies and focus on entertainment may not align well with Nestle's emphasis on health, nutrition, and sustainability."
Lululemon,Akon,0.25,"While Akon has a successful music career and philanthropic efforts, his public persona and past controversies do not align with Lululemon's emphasis on wellness, mindfulness, and community engagement, which may hinder authenticity and credibility for the brand."
Lyft,Alexandra Cooper,0.75,"Alexandra Cooper embodies a modern, tech-savvy lifestyle and has a strong connection with a diverse audience, making her suitable for Lyft's urban mobility focus. However, her content primarily revolves around personal experiences and relationships, which may not directly align with Lyft's emphasis on reliability and sustainability."
Redbull,Alexandra Cooper,0.3,"While Alexandra Cooper has a strong following and embodies a dynamic lifestyle, her content primarily focuses on relationships and personal advice rather than extreme sports or high-energy activities, which are central to Redbull's brand identity."
Kroger,Alexandra Cooper,0.45,"While Alexandra Cooper has a strong influence and reach, her content primarily focuses on personal experiences and relationships rather than culinary expertise or family-oriented themes, which may not align closely with Kroger's brand values of reliability and community connection."
Sephora,Alexandra Cooper,0.75,"Alexandra Cooper has a strong following and influence, particularly among younger audiences, and her recent launch of Unwell Hydration indicates her interest in wellness and beauty. However, her primary focus has been on lifestyle and relationship topics rather than beauty specifically, which may limit her alignment with Sephora's beauty-centric criteria."
Nestle,Alexandra Cooper,0.85,"Alexandra Cooper's recent launch of Unwell Hydration, a beverage line aimed at women's wellness, aligns well with Nestle's focus on health and nutrition. Additionally, her strong engagement with a diverse audience and her commitment to authenticity enhance her suitability for promoting Nestle's products."
Lululemon,Alexandra Cooper,0.75,"Alexandra Cooper promotes a lifestyle that includes wellness and personal growth, aligning with Lululemon's values; however, her primary focus on comedy and relationships may not fully resonate with Lululemon's core fitness and yoga audience."
Lyft,Ali Wong,0.75,"Ali Wong embodies a modern, tech-savvy lifestyle and has a diverse audience appeal, aligning well with Lyft's focus on urban mobility and inclusivity. However, her content may not consistently emphasize sustainability and community initiatives, which are key criteria for Lyft."
Redbull,Ali Wong,0.2,"Ali Wong's content primarily focuses on comedy and personal storytelling rather than extreme sports or high-energy activities, which does not align with Redbull's adventurous brand identity."
Kroger,Ali Wong,0.75,"Ali Wong's relatable and authentic comedic style resonates with family life, aligning well with Kroger's focus on everyday living; however, her content may not consistently emphasize culinary expertise or sustainability, which are key brand criteria."
Sephora,Ali Wong,0.3,"While Ali Wong is a well-known figure with a strong following, her primary focus is on comedy and entertainment rather than beauty, skincare, or cosmetics, which may not align with Sephora's brand criteria."
Nestle,Ali Wong,0.75,"Ali Wong's comedic style and authenticity resonate well with diverse audiences, aligning with Nestle's focus on community engagement and inclusivity. However, her content may not consistently emphasize health and nutrition, which is a key criterion for the brand."
Lululemon,Ali Wong,0.6,"While Ali Wong is a prominent figure in the entertainment industry and promotes themes of personal growth and authenticity, her primary focus is on comedy and entertainment rather than fitness or wellness, which may not fully align with Lululemon's brand values."
Lyft,Alix Earle,0.75,"Alix Earle embodies a modern, tech-savvy lifestyle and has a strong connection with a diverse audience, making her a good fit for Lyft's urban mobility focus. However, her content primarily revolves around beauty and personal life, which may not directly align with Lyft's emphasis on reliability and sustainability."
Redbull,Alix Earle,0.3,"Alix Earle's content primarily focuses on beauty and lifestyle rather than extreme sports or high-energy activities, which does not align well with Redbull's adventurous brand identity."
Kroger,Alix Earle,0.65,"Alix Earle's relatable content and strong community connection align with Kroger's values, but her focus on beauty and lifestyle may not fully resonate with the brand's emphasis on culinary expertise and family-oriented messaging."
Sephora,Alix Earle,0.95,"Alix Earle's strong presence in the beauty space, particularly through her 'Get Ready With Me' videos, aligns well with Sephora's criteria for beauty expertise and trendsetting, while her authenticity and engagement with her audience enhance her suitability as a brand ambassador."
Nestle,Alix Earle,0.75,"Alix Earle's strong engagement with a young audience and her focus on personal wellness resonate with Nestle's health and nutrition goals, but her content primarily revolves around beauty and lifestyle rather than food and nutrition specifically."
Lululemon,Alix Earle,0.75,"Alix Earle embodies an active lifestyle and has a strong engagement with her audience, but her content primarily focuses on beauty and personal life rather than fitness and wellness, which may not fully align with Lululemon's core values."
Lyft,Amelie Zilber,0.85,"Amelie Zilber embodies a modern, tech-savvy lifestyle and has a strong social media presence, which aligns well with Lyft's focus on urban mobility and community engagement. Her advocacy for social justice and climate change also resonates with Lyft's commitment to sustainability."
Redbull,Amelie Zilber,0.45,"Amelie Zilber's background in fashion and social activism does not strongly align with Redbull's extreme sports and high-energy lifestyle focus, though her dynamic visual storytelling and engagement with a youthful audience may offer some potential."
Kroger,Amelie Zilber,0.75,"Amelie Zilber's focus on social justice and community engagement aligns well with Kroger's values of authenticity and community connection, but her primary identity as a fashion model may not strongly emphasize culinary expertise or health focus."
Sephora,Amelie Zilber,0.75,"Amelie Zilber's background as a model for high-end brands and her engagement in social issues align well with Sephora's values of authenticity and inclusivity. However, her specific focus on beauty expertise and trendsetting is less emphasized in the provided information."
Nestle,Amelie Zilber,0.75,"Amelie Zilber's focus on social justice and sustainability aligns well with Nestle's commitment to ethical practices and community engagement, while her background in fashion and modeling may not directly reflect the diverse portfolio of Nestle's food and beverage products."
Lululemon,Amelie Zilber,0.75,"Amelie Zilber embodies an active lifestyle and has a strong focus on social justice and sustainability, aligning well with Lululemon's values. However, her primary content may not consistently emphasize fitness and wellness, which slightly lowers her suitability."
Lyft,Anitta,0.9,"Anitta embodies a modern, tech-savvy lifestyle and has a strong influence in urban culture, making her a great fit for Lyft's focus on urban mobility and inclusivity. Her advocacy for social issues and community engagement aligns well with Lyft's values of sustainability and social impact."
Redbull,Anitta,0.85,"Anitta embodies a vibrant and adventurous lifestyle, often engaging in high-energy performances and collaborations that resonate with Redbull's extreme sports ethos. Her dynamic visual storytelling and strong community engagement further align with the brand's innovative and trendsetting criteria."
Kroger,Anitta,0.75,"Anitta's diverse background and strong community connection align well with Kroger's values, but her focus on entertainment and pop culture may not fully resonate with the brand's emphasis on culinary expertise and everyday family life."
Sephora,Anitta,0.9,"Anitta's strong presence in the beauty and fashion industry, along with her diverse audience and engagement, aligns well with Sephora's criteria for authenticity, inclusivity, and trendsetting in beauty."
Nestle,Anitta,0.75,"Anitta's diverse audience and strong social media presence align well with Nestle's global appeal, but her focus on entertainment and lifestyle may not fully emphasize health and nutrition, which is crucial for the brand."
Lululemon,Anitta,0.75,"Anitta embodies an active lifestyle and has a strong presence in wellness and community engagement, but her brand image is more aligned with pop culture and entertainment than the premium, mindful aesthetics Lululemon seeks."
Lyft,Anthony Anderson,0.45,"Anthony Anderson's comedic and entertainment background may not fully align with Lyft's emphasis on reliability and trustworthiness, though he does appeal to a diverse audience. His recent controversies could also detract from the brand's image of safety and community focus."
Redbull,Anthony Anderson,0.3,"Anthony Anderson's content primarily revolves around comedy and television, lacking the extreme sports and adventurous lifestyle that Redbull embodies, which diminishes his alignment with the brand's core identity."
Kroger,Anthony Anderson,0.6,"Anthony Anderson's background in entertainment and culinary shows aligns with Kroger's focus on community and healthy eating, but his recent controversies may detract from the brand's image of reliability and approachability."
Sephora,Anthony Anderson,0.2,"Anthony Anderson's background as an actor and comedian does not align with Sephora's criteria for beauty expertise and trendsetting, and he lacks a strong focus on beauty content, which is essential for effective brand representation."
Nestle,Anthony Anderson,0.45,"While Anthony Anderson has a strong public presence and engages with diverse audiences, his recent controversies related to sexual assault allegations may undermine the authenticity and trustworthiness that Nestle seeks in its influencers, impacting overall suitability."
Lululemon,Anthony Anderson,0.3,"While Anthony Anderson is a well-known figure with a strong presence, his recent controversies, including allegations of sexual assault, may undermine Lululemon's emphasis on authenticity and ethical practices, which are crucial for their brand image."
Lyft,Anthony Davis,0.75,"Anthony Davis embodies a modern, tech-savvy lifestyle as a prominent NBA player, which aligns with Lyft's urban mobility focus. However, his recent injury concerns may affect perceptions of reliability and trustworthiness."
Redbull,Anthony Davis,0.75,"Anthony Davis embodies a high-energy lifestyle and has a strong presence in the sports community, making him a good fit for Redbull's adventurous brand. However, his recent injury concerns may affect his ability to consistently engage in extreme activities, which is a key aspect of Redbull's identity."
Kroger,Anthony Davis,0.45,"While Anthony Davis is a well-known athlete with a strong community presence, his focus on sports and entertainment may not align closely with Kroger's emphasis on culinary expertise, healthy eating, and family-oriented content."
Sephora,Anthony Davis,0.0,"Anthony Davis is a professional basketball player with no evident expertise or passion for beauty, skincare, or cosmetics, making him unsuitable for promoting Sephora's brand values and criteria."
Nestle,Anthony Davis,0.6,"While Anthony Davis has a strong public presence and can appeal to a global audience, his primary focus is on sports rather than health and nutrition, which may not align perfectly with Nestle's emphasis on balanced diets and wellness."
Lululemon,Anthony Davis,0.75,"Anthony Davis embodies an active lifestyle as a professional athlete, which aligns with Lululemon's values; however, his recent injury concerns may affect his credibility in promoting a consistent wellness message."
Lyft,Arnold Schwarzenegger,0.75,"Arnold Schwarzenegger embodies a modern, tech-savvy lifestyle and has a strong public image focused on fitness and community, but his past controversies may detract from the reliability and trustworthiness that Lyft seeks in its influencers."
Redbull,Arnold Schwarzenegger,0.95,"Arnold Schwarzenegger embodies an adventurous and extreme lifestyle, having a history in bodybuilding and action films that align with Redbull's brand identity. His dynamic storytelling and engagement with fitness and sports communities further enhance his suitability as a brand ambassador."
Kroger,Arnold Schwarzenegger,0.6,"While Arnold Schwarzenegger has a strong public image and a commitment to health and fitness, his celebrity status and focus on action and entertainment may not align closely with Kroger's emphasis on everyday family life, community connection, and culinary expertise."
Sephora,Arnold Schwarzenegger,0.1,"Arnold Schwarzenegger's background is primarily in bodybuilding, acting, and politics, with no evident focus on beauty or skincare, making him largely unsuitable for Sephora's beauty-centric brand criteria."
Nestle,Arnold Schwarzenegger,0.75,"Arnold Schwarzenegger's strong focus on health, fitness, and nutrition aligns well with Nestle's commitment to wellness, but his past controversies and political affiliations may raise concerns about authenticity and community engagement."
Lululemon,Arnold Schwarzenegger,0.9,"Arnold Schwarzenegger embodies an active lifestyle and has a strong connection to fitness and wellness, aligning well with Lululemon's values. His credibility as a fitness icon and commitment to community engagement further enhance his suitability for the brand."
Lyft,Awkwafina,0.75,"Awkwafina embodies a modern, urban lifestyle and has a diverse appeal, making her a good fit for Lyft's focus on inclusivity and community. However, her past controversies may affect perceptions of reliability and trustworthiness."
Redbull,Awkwafina,0.45,"Awkwafina's energetic persona and involvement in entertainment resonate with Redbull's brand ethos, but her primary focus on comedy and acting rather than extreme sports limits her alignment with the brand's adventurous lifestyle."
Kroger,Awkwafina,0.6,"Awkwafina's diverse background and relatable persona align with Kroger's focus on community and inclusivity, but her content primarily revolves around entertainment rather than culinary expertise or family-oriented themes, which may limit her effectiveness in promoting grocery-related products."
Sephora,Awkwafina,0.75,"Awkwafina has a strong presence in the entertainment industry and has been involved in beauty-related campaigns, but her primary focus is on comedy and acting rather than beauty expertise, which may limit her alignment with Sephora's criteria."
Nestle,Awkwafina,0.75,"Awkwafina's diverse background and broad appeal align well with Nestle's global audience, but her past controversies regarding cultural appropriation may impact perceptions of authenticity and trustworthiness."
Lululemon,Awkwafina,0.45,"While Awkwafina has a strong public image and engages with diverse audiences, her primary focus on comedy and entertainment does not align closely with Lululemon's emphasis on wellness, fitness, and mindfulness."
Lyft,Bad Bunny,0.85,"Bad Bunny embodies a modern, tech-savvy lifestyle and has a strong connection with diverse urban audiences, making him a good fit for Lyft's focus on inclusivity and community. His activism and emphasis on social issues align well with Lyft's commitment to sustainability and social impact."
Redbull,Bad Bunny,0.85,"Bad Bunny embodies a bold and adventurous lifestyle, resonating with Redbull's extreme sports ethos, and his dynamic visual storytelling aligns well with the brand's energetic identity. However, while he engages a large community, his primary focus is music rather than extreme sports, which slightly limits his fit."
Kroger,Bad Bunny,0.25,"While Bad Bunny has a strong cultural influence and appeals to a diverse audience, his brand image and content focus on music and activism do not align closely with Kroger's emphasis on everyday family life, culinary expertise, and community connection."
Sephora,Bad Bunny,0.25,"While Bad Bunny has a massive following and engages with diverse audiences, his primary focus is on music and activism rather than beauty, which may not align with Sephora's criteria for beauty expertise and trendsetting."
Nestle,Bad Bunny,0.6,"While Bad Bunny has a strong global appeal and engages diverse communities, his content primarily focuses on music and cultural themes rather than health and nutrition, which may not align closely with Nestle's brand criteria."
Lululemon,Bad Bunny,0.75,"Bad Bunny embodies an active lifestyle and engages in community activism, but his primary focus is on music and entertainment rather than fitness and wellness, which may not fully align with Lululemon's core values."
Lyft,Bert Kreischer,0.45,"Bert Kreischer's persona as a party-loving comedian may not align with Lyft's emphasis on reliability, safety, and eco-friendliness, though his storytelling ability could engage audiences effectively."
Redbull,Bert Kreischer,0.85,"Bert Kreischer embodies a bold and adventurous lifestyle, often engaging in extreme activities and storytelling that aligns well with Redbull's energetic brand ethos. His dynamic content and strong community engagement further enhance his suitability for promoting the brand."
Kroger,Bert Kreischer,0.35,"Bert Kreischer's comedic persona and party-centric lifestyle may not align well with Kroger's focus on family-oriented, healthy living and community values, despite his popularity and relatability."
Sephora,Bert Kreischer,0.1,"Bert Kreischer's content primarily focuses on comedy and storytelling rather than beauty or skincare, lacking the necessary expertise and engagement in the beauty space that Sephora requires."
Nestle,Bert Kreischer,0.3,"Bert Kreischer's comedic persona and lifestyle, which often emphasize partying and indulgence, may not align well with Nestle's focus on health, nutrition, and sustainability, potentially undermining the brand's values."
Lululemon,Bert Kreischer,0.25,"Bert Kreischer's persona as a party-loving comedian does not align with Lululemon's focus on wellness, mindfulness, and an active lifestyle, which may hinder authenticity and credibility in promoting the brand."
Lyft,Big Sean,0.85,"Big Sean embodies a modern, tech-savvy lifestyle and has a strong connection to urban culture, making him a good fit for Lyft's focus on urban mobility and community. His engagement in social issues and initiatives aligns well with Lyft's commitment to inclusivity and sustainability."
Redbull,Big Sean,0.75,"Big Sean embodies a bold and adventurous lifestyle through his music and public persona, aligning well with Redbull's extreme sports and high-energy activities. However, while he engages with a dynamic audience, his primary focus is on music rather than extreme sports, which may limit his fit for Redbull's specific brand criteria."
Kroger,Big Sean,0.6,"Big Sean's influence in the music industry and his community involvement align with Kroger's values of authenticity and community connection; however, his primary focus on music and entertainment may not fully resonate with Kroger's emphasis on culinary expertise and everyday family life."
Sephora,Big Sean,0.2,"Big Sean is primarily known as a rapper and musician, lacking a strong focus on beauty, skincare, or cosmetics, which are essential for Sephora's brand criteria. His content does not align with the beauty expertise and trendsetting required by the brand."
Nestle,Big Sean,0.6,"Big Sean has a strong influence and a diverse audience, but his primary focus on music and entertainment may not align closely with Nestle's health, nutrition, and sustainability criteria."
Lululemon,Big Sean,0.45,"While Big Sean has a successful music career and engages in community initiatives, his primary brand image is centered around hip-hop culture rather than the active, mindful lifestyle that Lululemon promotes, which may limit his alignment with the brand's core values."
Lyft,Bowen Yang,0.85,"Bowen Yang embodies a modern, tech-savvy lifestyle and has a strong connection to diverse urban audiences, making him a good fit for Lyft's focus on inclusivity and community. His comedic background and storytelling ability can effectively engage audiences, though his content may not always emphasize reliability and sustainability directly."
Redbull,Bowen Yang,0.25,"While Bowen Yang is a prominent figure in comedy and entertainment, his content does not align with Redbull's extreme sports and adventurous lifestyle focus, which may limit his effectiveness as a brand ambassador."
Kroger,Bowen Yang,0.75,"Bowen Yang's diverse background and connection to the LGBTQ community align well with Kroger's focus on diversity and inclusivity, but his content primarily revolves around comedy and pop culture rather than culinary expertise or family-oriented themes."
Sephora,Bowen Yang,0.3,"While Bowen Yang is a prominent figure in entertainment and has a diverse audience, he lacks a strong focus on beauty and skincare, which are essential for Sephora's brand criteria. His content does not primarily engage with beauty trends or product knowledge, making him less suitable for this brand."
Nestle,Bowen Yang,0.6,"Bowen Yang's comedic and cultural influence aligns well with Nestle's diverse portfolio, but his content primarily focuses on entertainment rather than health and nutrition, which may not fully resonate with Nestle's emphasis on wellness and sustainability."
Lululemon,Bowen Yang,0.6,"While Bowen Yang is a prominent figure in the entertainment industry and engages with diverse audiences, his content primarily focuses on comedy and LGBTQ representation rather than fitness or wellness, which may not align closely with Lululemon's brand values."
Lyft,Bryan Cranston,0.75,"Bryan Cranston embodies a modern lifestyle and has a strong public image, but his association with dramatic roles like Walter White may not align perfectly with Lyft's focus on reliability and community inclusivity."
Redbull,Bryan Cranston,0.2,"While Bryan Cranston is a highly acclaimed actor known for his roles in dramatic series, he does not embody the extreme lifestyle or adventurous spirit that aligns with Redbull's brand identity, which focuses on extreme sports and high-energy activities."
Kroger,Bryan Cranston,0.75,"Bryan Cranston's approachable persona and strong community ties align well with Kroger's values, but his celebrity status may not fully resonate with the everyday family life aspect the brand seeks to emphasize."
